{"run_id":"run-1","verdict":"bug","summary":"Dos flujos fallidos","findings":[{"finding_id":"flow-1","root_cause":"causa a","invariant":"inv a","method":"POST","path":"/orders","evidence_uris":["s3://aqs-evidence/runs/run-1/flow-1/result.json","s3://aqs-evidence/runs/run-1/flow-1/logs.txt"]},{"finding_id":"flow-2","root_cause":"causa b","invariant":"inv b","method":"PATCH","path":"/orders/{id}","evidence_uris":["https://evidence.example/run-1/flow-2/result.json"]}]}
